{
  "schema_version": "ISRAS-AUTHORITY-BOUNDARY-V1",
  "boundary_id": "example-api-worker",
  "repository": "Iron-Signal-Systems/example-repository",
  "name": "Example API to worker boundary",
  "boundary_type": "QUEUE",
  "description": "Example draft boundary record to be replaced with repository-specific facts.",
  "source_component": "example-api",
  "target_component": "example-worker",
  "requested_operations": [
    "process-example-job"
  ],
  "identity_model": {
    "acting_identity": "example-worker-identity",
    "credential_type": "signed-work-envelope",
    "service_identity_separate_from_user_identity": true,
    "administrative_identity_separate_from_ordinary_identity": true,
    "credentials_reused_across_unrelated_boundaries": false
  },
  "minimum_authority": [
    "read accepted example job",
    "write example job result"
  ],
  "explicit_denials": [
    "database owner",
    "system administrator",
    "unrelated queue access"
  ],
  "authorization": {
    "deny_by_default": true,
    "independent_at_boundary": true,
    "decision_point": "worker ingress authorization",
    "delegation_scoped_to_operation": true
  },
  "privilege_propagation": {
    "automatic_propagation_prohibited": true,
    "unrestricted_execution_context_prohibited": true,
    "retry_replay_recovery_cannot_increase_authority": true
  },
  "database_authority": {
    "applicable": false,
    "runtime_uses_owner_or_superuser": false,
    "migration_authority_separate_from_runtime": true,
    "operation_appropriate_roles": true
  },
  "role_accumulation": {
    "evaluated": true,
    "unrestricted_authority_prevented": true,
    "control": "Explicit permission ceiling and conflicting-role rejection."
  },
  "elevation_and_break_glass": {
    "applicable": false,
    "explicit": true,
    "time_bounded": true,
    "attributable": true,
    "audited": true,
    "reviewed_after_use": true
  },
  "revocation": {
    "supported": true,
    "session_invalidation_supported": true,
    "queued_or_retried_work_reauthorized": true
  },
  "audit": {
    "acting_principal": true,
    "effective_authority": true,
    "requested_action": true,
    "decision": true,
    "result": true,
    "correlation": true
  },
  "hostile_tests": [
    {
      "test_class": "forged work envelope",
      "applicability": "APPLICABLE",
      "status": "NOT_RUN",
      "evidence_path": null
    }
  ],
  "maturity": "DOCUMENTED",
  "evidence_paths": [
    "docs/architecture/example-authority-boundary.md"
  ],
  "owner": "repository-owner",
  "review": {
    "status": "DRAFT",
    "reviewer": "pending-reviewer",
    "date": "2026-01-01"
  }
}
